{
  "schema_version": "1.0.0",
  "kind": "layout",
  "meta": {
    "pipeline_id": "coding-pipeline",
    "name": "协同编码管线（执行段）"
  },
  "viewport": {
    "x": 0,
    "y": 196,
    "zoom": 0.53
  },
  "canvas": {
    "grid": {
      "size": 20,
      "visible": true
    },
    "background": "#0f1115"
  },
  "nodes": {
    "n_req": {
      "x": 60,
      "y": 400
    },
    "n_p0": {
      "x": 340,
      "y": 400
    },
    "n_p1": {
      "x": 620,
      "y": 300
    },
    "n_p1b": {
      "x": 620,
      "y": 560
    },
    "n_p2": {
      "x": 900,
      "y": 320
    },
    "n_p3a": {
      "x": 1180,
      "y": 240
    },
    "n_p3b": {
      "x": 1180,
      "y": 560
    },
    "n_p4": {
      "x": 1460,
      "y": 400
    },
    "n_end": {
      "x": 1740,
      "y": 400
    }
  }
}
